Post_ID,Shortcode,URL,Date,Time,Format_Type,Likes,Comments,Views,Is_Paid_Partnership,Total_Collaborators,Caption
3677298302190107397,DMIY1KbMDsF,https://www.instagram.com/p/DMIY1KbMDsF/,2025-07-15,16:05:15,clips,888,10,,False,2,"Přírodní řeky, to je často jak nějaká Amazonie, ale s nám dobře známýma tvorama - vážky, žáby a mezi tim třeba stulík ❤️🦋🐸 |  | #vazka #dragonfly #reka #voda #tun #zaba #nature #priroda #wildlife #river #meandr #kytka #hmyz #motylice"
3676712937331094204,DMGTu-6s_K8,https://www.instagram.com/p/DMGTu-6s_K8/,2025-07-14,20:52:42,clips,3,22,,False,5,"Cestovní vlogísek (Michale to máme pro pojišťovnu)🚗💨 |  | V lednu jsme vyrazili do Brightonu s Denyškou. Chytili jsme příležitost (tedy stabilní nádor) za pačesy a rozhodli se vyjet, protože u takový nemoci fakt nikdo neví, kolik času zbývá (ne že bychom my věděli, kolik toho máme před sebou, že😃) a chtěla jsem aspon částečně zažít život s Denouškem u moře, v mym druhym domovu. Vyjeli jsme s autem narvaným věcma, svačinama, dobrou náladou a tunou stresu. Před náma bylo: cca 1200km, trajekt, kterej byl objednanej na konkrétní čas, takže jsme ho museli stihnout, sněžná bouře od půlky Německa až do Belgie, mega chcanec od Belgie do Brightonu.  |  | Před cestou jsem musela zkontrolovat psí pas, platnost očkování na vzteklinu, těsně před cestou Denu odčervit a mít to potvrzený v pasu. Pes musí mít samozřejmě čip. No a taky jsme si přikoupili psí lounge, protože jinak pes musí zůstat v autě. V přístavu vám zkontrolujou papíry, čip, dají vám značení na auto a jedete do fronty, kde čeká britskej ouředník, kterej zkontroluje vaše pasy a důvod cesty. A pak už jen jedete čekat ma trajekt. V místě čekání se nic dělat nedá, je tam budova se záchodama (dávám tak 6/10), kavárnou, burger kingem a obchodem. Tím, že po cestě do UK jsme skoro nespali, tak to byl náš čas na nap.  |  | No a zbytek už znáte. Na sobě jsem měla super lehoučkou péřovku Patagonia z @freshlabels, kterou jsem nosila v kombinaci s vestou celou zimu. Je to super vrstva a funguje i samostatně. A na konci videa mám na sobě pláštěnku Rains, tu jsem vynosila taky strašně moc. Navíc v ní člověk vypadá jak nějakej bachař z říše, takže třeba Filip Turek by to ocenil hodně, ale lidi v Bergheinu taky. 🤌🏽 |  | Závěrem do auta radím na delší cesty vodu ve spreji na obličej (měli jsme Balea z DM za 39kč), dobrá prevence proti mikrospánkům (a taky samozřejmě pauzy, jídlo a káva)).  |  | Tak ahój!🥹 |  | #freshlabels #beyondsurface #spoluprace #dobritaniesepsem"
3676516822874625279,DMFnJJGMJT_,https://www.instagram.com/p/DMFnJJGMJT_/,2025-07-14,14:09:40,carousel_container,391,3,,False,6,"Service Works 🔪 |  | Zrozena v roce 2020 z čisté lásky pro elasťáky a dobré jidlo, značka Service Works postupně dobývá srdce gastro světa, ale své místo si najde i v módním šatníku, protože chef může vypadat skvěle nejen v práci, ale i po práci |  | 📸 @vojtechvole  | #freshlabels #beyondsurface #serviceworks"
3675074298321679395,DMAfJpaobQj,https://www.instagram.com/p/DMAfJpaobQj/,2025-07-12,14:23:37,carousel_container,3,2,,False,2,"Ahoj, tady prší — 🙋🏼‍♀️🌧️ |  | ✨#comfy outfit slideshow a inspirace | ✨brunch  | ✨knihkupectví a tipy na knížky |  | #allblackoutfit se zdál jako super mama nápad — ale jsou ma něm vidět všechny sušenky a piškoty 💁🏼‍♀️🙆🏼‍♀️ |  | KÓD: freshbaci15 |  | Tak zase ahooooj!👋🏻 |  | #weekendvibes #momsoutfit"
3674460533645994475,DL-TmMhKWnr,https://www.instagram.com/p/DL-TmMhKWnr/,2025-07-11,18:04:11,carousel_container,168,14,,False,2,"Dropněte svoje hammock camping tips&tricks 👇 |  | Hoodie, Tee & Shorts from @freshlabels"
3674328234904958363,DL91g_tsrWb,https://www.instagram.com/p/DL91g_tsrWb/,2025-07-11,13:45:59,clips,40,4,,False,0,"Kabelky, tašky, crossbody, zavazadla 👜 |  | Vybavte se na vaše letní dobrodružství na Freshlabels  |  | 🎥 @natythechild  | 👧 @terramssc  |  | #freshlabels #beyondsurface #crossbody"
3674187832885503489,DL9Vl4JM-YB,https://www.instagram.com/p/DL9Vl4JM-YB/,2025-07-11,09:04:43,clips,213,11,,False,0,"Co se vám vybaví, když se řekne Freshlabels?  |  | Začátek léta byl ve znamení spousta různých akcí a vy se můžete podívat, jak to u nás vypadalo 🤩 |  | Za report děkujeme @artspodcast  |  | #freshlabels #beyondsurface #freshlabelsustainablestore #freshlabelsflagshipstore #community"
3673639170602136435,DL7Y1yks3Nz,https://www.instagram.com/p/DL7Y1yks3Nz/,2025-07-10,14:52:17,carousel_container,33,0,,False,0,"Études Studio a FREITAG spojili síly a představují exkluzivní edici ikonické messenger tašky F41 HAWAII FIVE-0 |  | Tašky jsou vyrobené z recyklovaných plachet nákladních aut, pečlivě vybraných v odstínech modré – ikonické barvy pařížské módní značky – a zdobené jejich typickými hvězdami, sítotiskem nanesenými v Curychu. Každý kus je originál, s jedinečným příběhem cesty. |  | Na oslavu této spolupráce navštívili ateliér multidisciplinárního umělce Mohameda Bourouissy, místo, kde vedle sebe existují látky i myšlenky. Prostor, který odráží jeho cestu a vystihuje ducha celé spolupráce – umělecká taška plná významu, pevně zakořeněná v současné městské realitě. |  | Limitovaná edice je právě teď dostupná na našem letenském obchodě na Milady Horákové 11, Praha 7. Stavte se! |  | #frtg #ÉHair & Makeup: @raykmode | #ÉtudesStudio #collaboration #F41E #HAWAIIFIVE0 #messengerbag |  | Artist: @mohamedbourouissa  | Photograph: @jesperdlund  | Light: @christiannbragg"
3672978797359085522,DL5CsGEITfS,https://www.instagram.com/p/DL5CsGEITfS/,2025-07-09,17:04:50,clips,71,1,,False,0,Co všechno se dá zabalit do batohu Klättermusen Ull 30L?  |  | Mrkněte na video a vyražte na cesty 🤩 |  | 🎥 @arifuk  |  | #freshlabels #beyondsurface #klättermusen
3670916395881882621,DLxtwNAsmP9,https://www.instagram.com/p/DLxtwNAsmP9/,2025-07-06,21:13:38,clips,247,3,,False,3,"V horách jsem mega šťastná, i když to někdy nejde podle plánu! ⛰️ |  | Malá ochutnávka z Picos de Europa, kam jsme vyrazily s @lucijef začátkem června.  |  | Lanovkou z Fuente Dé, která vás vynese o 800 m výše a pak už si můžete vesele šlapat po horách. Našim cílem bylo Refugio de Urriellu, kde jsme měly přespat a druhý den se vrátit zpět do našeho kempu.  |  | Po pauzičce v Cabaña Verónica jsme chtěly vylézt do sedla hor Horcados Rojos a Pico Tesorero a pak pokračovat sestupem až k Urriellu. Terén byl ale tak strmý, plný sněhových polí a chyběla pomocná lana, že jsme se rozhodly to neriskovat a otočily jsme to zpět k lanovce. Poprvý v životě mi intuice naznačila neriskovat.  | I tak to bylo ale boží! Obklopené horami, kde nás v naších krocích doprovázely Alpské kavky 🐦‍⬛.  |  | Před výletem jsem doplnila gear o windbreaker bundu Patagonia Houdini stash, která je teď na @freshlabels ve slevě 🫶🏻.  |  | Ani tady mě nezklamala fleecovka taky od Patagonie Retro Pile Jacket, která je taky ve slevě. |  | A skvěle se mi hikovalo v mých univerzálních @gramicci kraťasech aká skort (shorts and skirt in 1). Jako všechno od Gramicci je hodně pohodlný!  |  | Sumasumárum, s Patagonii ani s Gramicci nešlápnete vedle, otestováno a stále testováno za vás. ✌🏼 | Na novinky a další zboží můžete uplatnit 15 % slevu s kódem freshackovka15"
3670876422344569705,DLxkqgwNHNp,https://www.instagram.com/p/DLxkqgwNHNp/,2025-07-06,19:30:36,clips,358,203,,False,4,"soutěž o dovolenku se mnou @fjallravenofficial @freshlabels a tvojí +1 na Slovensku v Bílých karpatech!!😍⭐️✨✨✨ | Sleduj můj profil, @freshlabels profil a označ do komentáře kámoše se kterým máš v plánu vyrazit!😍 #campfire #fjallräven #fjallraven #campfirefjallraven"
3668501983321415140,DLpIx4FsF3k,https://www.instagram.com/p/DLpIx4FsF3k/,2025-07-03,12:48:06,clips,271,10,,False,7,Jak to vypadalo na speciálním community runquestu se @sidequesty a @sony.czsk ? |  | To se dozvíte ve videu 🤯 |  | Za reportáž děkujeme @artspodcast  |  | #freshlabels #beyondsurface #sidequesty #sonyczsk
3668018535662218921,DLna2yXse6p,https://www.instagram.com/p/DLna2yXse6p/,2025-07-02,20:45:05,carousel_container,96,0,,False,1,Gramicci Summer |  | To nejčerstvější z kolekce Gramicci najdete na Freshlabels 👌🏻 |  | 📸 @tomtejkl  | 👧 @dena.ink  | 👦 @bol_to_sen |  | #freshlabels #beyondsurface #gramicci
3667875928921048509,DLm6blfi4W9,https://www.instagram.com/p/DLm6blfi4W9/,2025-07-02,16:01:45,carousel_container,178,3,,False,6,Natalie pro @freshlabels / @olend_backpacks summer 2/2
3667821485809278705,DLmuDVZNR7x,https://www.instagram.com/p/DLmuDVZNR7x/,2025-07-02,14:40:25,clips,3,28,,False,2,"🤸🏾‍♂️ The Macaco is one of the most useful  moves you can learn, not just for acrobatics, but to fall like a ninja 🥷. |  | This is the first tutorial we’re dropping with @freshlabels 🔥movement with style. | 💾 Save it, try it, tag a friend who ALWAYS falls, and let us know which move should be next! |  | #parkour #acrobatics #tutorial #macaco #makako #flips #backwards #praha #freshlabels #urbanmovement #fallwithstyle #pardubice #jump #cliff #learn"
3667256538931009651,DLktmRnNhhz,https://www.instagram.com/p/DLktmRnNhhz/,2025-07-01,19:31:08,carousel_container,2505,14,,False,4,"Rok se s rokem sešel a já začínám balit do Varů. Co vy? Už jste ready? Pokud ne, společně s @freshlabels jsme pro vás vybrali 3 outfity, které můžete vynést do kina, na chill do parku, nebo na večírek. Stačí birkenstocky vyměnit na podpatky a můžete vyrazit. Pokud se vám něco ve freshlabels líbí, nebojte se využít můj slevový kód: FRESHGABI15 ! Nezapomeňte na pokrývku hlavy a lahev na vodu. Vidíme se ve Varech💫"
3666997283278442068,DLjypm-Ik5U,https://www.instagram.com/p/DLjypm-Ik5U/,2025-07-01,10:57:27,clips,3,7,,False,2,"Jídelní stůl = moje pracovna 🙆🏼‍♀️🙋🏼‍♀️ | … u tohohle stolu vznikají všechny #voiceover, povídání do uší na hero, a také nápady na společné workshopy  |  | ✨svíčka @so.slowproducts : pačuli, levandule, šalvěj (tohle kombo tak moc miluju, že ho používáme i v olejích na YOGA & ESSENCE) |  | ✨květina od @vecny_kviti  |  | ✨tip na horké dny: domácí (ledový) černý čaj + citron + med |  | ✨kód na @freshlabels : FRESHBACI15 |  | ✨Ptáte se mě i na to, odkud máme stůl. Ten nám dělal nejšikovnější @shed_boards  |  | 💦🏖️Užívám si volné minuty, než se Bertík vzbudí. Dnes jdeme k bazénu, juhuuuu — proto ty plavky a šaty.  |  | Tak pa, | Baci💗 |  | #baciyoga #momslife #homeoffice"
3665552065212481678,DLeqC6wsICO,https://www.instagram.com/p/DLeqC6wsICO/,2025-06-29,11:04:39,carousel_container,844,3,,False,4,"Komono Summer ⛱️ |  | Léto chvíli potrvá, tak si jej vychutnejte díky slunečním brýlím Komono společně s @gufrau_official  |  | Více najdete na Freshlabels |  | 📸 @zemankuba  |  | #freshlabels #beyondsurface #komono"
3664082369369567011,DLZb4B2C28j,https://www.instagram.com/p/DLZb4B2C28j/,2025-06-27,10:29:36,clips,3,35,,False,5,"Jen 30 minut od Prahy a máš pocit, že jsi úplně jinde  #24 🛼 | Řeka, les, ranč… a na konci? Lom Alkazar – krásná lezecká oblast 🧗‍♂️ | Trasa z Berouna až k lomu, jen 3,4 km – příjemný asfalt, ideální i pro začátečníky. | Navíc výhledy, klid a v létě po cestě i občerstvení 🍹 |  | 💾 Ulož si ji | 💬 A napiš „BEROUN“, pokud chceš víc takových tipů |  | 🧢 Co jsem měl na sobě (a 100 % doporučuju): | – Kšiltovka: P-6 Label Trad Cap | – Tričko: Fitz Roy Icon Responsibili-Tee | – Kraťasy: M's Baggies Shorts – 5 in. | – Ledvinka: Ultralight Black Hole Mini | Vše od @patagonia – funkční, lehké a stylové ✔️ |  | 💥 A jo, mám i něco pro vás: | 🎁 Sleva 15 % na celý sortiment @freshlabels | ✅ Stačí použít kód: FRESHPAVEL15 | Najdeš tam i všechny moje kousky! |  | #kamnabrusle #milujemeprirodu #cestolidi #tipynavylety #cestujemepocesku #ceskojekrasne #ceskakrajina #vistcz"
3663316925879114558,DLWt1XCs1s-,https://www.instagram.com/p/DLWt1XCs1s-/,2025-06-26,09:05:12,clips,66,5,,False,1,"Co se všechno vejde do batohu pinqponq Blok Medium? |  | Kdybyste tápali, kolik se vejde do batohu věcí, @arifuk vám to názorně předvede, abyste už nemuseli tápat 🤯 |  | #freshlabels #beyondsurface #pinqponq"
3661888197072470019,DLRo-nps0AD,https://www.instagram.com/p/DLRo-nps0AD/,2025-06-24,09:45:12,carousel_container,362,3,,False,6,Freshlabels Lookbook SS25 |  | Nechte se inspirovat čerstvými netradičními trendy pro tuhle sezónu 🤯 |  | 📸 @natythechild  | 👧 @dorota_dostalova  | 👦 @arundus_  | 💄 @monikasnopkova  | 🪡 @altner__  |  | #freshlabels #beyondsurface #lookbook #ss25
3661241728904587195,DLPV_RQMee7,https://www.instagram.com/p/DLPV_RQMee7/,2025-06-23,12:29:50,clips,219,83,,False,3,"SOUTĚŽ UKONČENA |  | Společně s @marcell_music jsme si pro vás připravili soutěz o 3x2 lístky na křest jeho společné desky s @fiedlerski PIZZA, PIVO, DOLCE VITA 🍕, který se koná 27.11.2025 v pražské Roxy |  | Co pro to musíte udělat?  | 1.  dejte lajk na tenhle příspěvek  | 2. označte parťáka, kterého byste vzali s sebou | 3. followujte @marcell_music a @freshlabels  |  | Výherce vylosujeme 1.7.  |  | #freshlabels #beyondsurface #marcell"
3661193634943061495,DLPLDaQs833,https://www.instagram.com/p/DLPLDaQs833/,2025-06-23,10:45:13,carousel_container,3,6,,False,2,🩵👋🏼🌞 |  | ~ summer kabelka & pantofle Birkenstock Boston. Děkuji @freshlabels. |  | [ #sun #summer #happy ]
3660793960854610696,DLNwLYwomMI,https://www.instagram.com/p/DLNwLYwomMI/,2025-06-22,21:31:08,carousel_container,171,1,,False,6,Natalie pro @freshlabels / @olend_backpacks summer 1/2
3660417644520085413,DLManQ3MRel,https://www.instagram.com/p/DLManQ3MRel/,2025-06-22,09:05:49,clips,3,8,,False,2,"GLOW UP NAŠÍ LOŽNICE — | ⁠ | Po malování zdí a přesunutí nábytku to chtělo vyladit detaily✨️⁠ | ⁠ | 🫧 vonný difuzér @voniak_home⁠ | 🕯️ sada svíček @so.slowproducts⁠ | 🪴 květináč @homestudyo.be⁠ | ⁠ | A ano, ano...něco jsem si opět pořídila i do skříně 🙈😅⁠ | 🦩 růžový tričko @armedangels⁠ | 🥷 černý overal @thinkingmu⁠ | ⁠ | A ano, ano…patřím teď mezi @freshlabels family&friends🫶 | — | #freshlabels #beyondsurface #spoluprace #dayinthelife"
3659889456361634898,DLKihHTofxS,https://www.instagram.com/p/DLKihHTofxS/,2025-06-21,15:35:06,clips,736,19,,False,8,"Dali jsme rekord!🌞 |  | A co vy? Zdravíte rádi slunce? My jsme se sešli v obrovským počtu a pozdravili ho 108x |  | Velké díky patří @cans_czsk 🩷, díky kterým jsme zůstali během sidequestu hydratovaní. |  | 🎥: @zdenek.art  |  | #sidequesty #freshlabels #bacidani #cans #yoga #sunsalutation #community #outdoor #active #challenge"
3659170183810081083,DLH--Uis2E7,https://www.instagram.com/p/DLH--Uis2E7/,2025-06-20,15:48:00,clips,46,2,,False,4,"Alex s Danielem zpátky na značkách.  | A značka zpátky ve @freshlabels ! | Bylo to fresh, bylo to milé a těšíme se, co všechno spolu znovu vymyslíme. Díky za krásné sobotní dopoledne. 💛 |  | Video: @monika.hartigova"
3659120364546683276,DLHzpWvM_GM,https://www.instagram.com/p/DLHzpWvM_GM/,2025-06-20,14:06:00,carousel_container,95,2,,False,2,Gramicci Summer 25 |  | Výběr toho nejčerstvějšího z kolekce Gramicci najdete na Freshlabels 🤙🏻 |  | Více v biu |  | 📸 @tomtejkl  | 👧 @dena.ink  | 👦 @bol_to_sen  |  | #freshlabels #beyondsurface #gramicci
3658294085652010410,DLE3xajM1Wq,https://www.instagram.com/p/DLE3xajM1Wq/,2025-06-19,10:47:28,clips,98,2,,False,4,Outfity na letní dovolenou ☀️ |  | Podlehněte lehkosti šatů Ecoalf spojené s nápaditými kabelkami Ölend  |  | Více na Freshlabels |  | 📹 @veronikakramlova  | 👧 @natali9_7  |  | #freshlabels #beyondsurface #ecoalf #olend
3657779970549287956,DLDC4DjIQwU,https://www.instagram.com/p/DLDC4DjIQwU/,2025-06-18,17:44:20,clips,305,3,,True,4,"Buď taky součástí jógového rekordu s @freshlabels, @sidequesty a @bacidani 🧘 doraž v pátek 20. června v 18:00 na ovál Letenské pláně a zacvič si 108 pozdravů slunci 🌞💞 Účast zdarma, stačí se registrovat na: |  | ▶️ LINK IN BIO |   | #refreshercz #freshlabels #spoluprace"
3657605783487572220,DLCbRTNMOj8,https://www.instagram.com/p/DLCbRTNMOj8/,2025-06-18,11:56:48,carousel_container,96,2,,False,14,"Brunch Rave & Spring Perfumes |  | V sobotu jste u nás na letenské prodejně mohli zažít nejnovější vůně @alexmonhart spojené se skvělým brunchem od @hungryeyesprague, kávou od @candycanecoffee a za doprovodu dj setu @_st.daniel_  |  | Podívejte, jak celá sobota vypadala 👀 |  | 📸 @alexandrez_off  |  | #freshlabels"
3656938930566310981,DLADpUBs6xF,https://www.instagram.com/p/DLADpUBs6xF/,2025-06-17,13:51:53,carousel_container,327,5,,False,4,"🚨 UPDATE - EVENT IS FULL! If you did not register until now, we can not let you in. We will be looking forward to meeting you at another sidequest 🙏 |  | 🔥 SPECIAL COMMUNITY RUNQUEST - LIMITED TO 100 PEOPLE 🔥 | 📅 Monday 23.6. | Prague |  | REGISTER LINK IN BIO |  | Ready for a Sidequest unlike any other? 🏃‍♂️🎶 | We’re blending running, music, food, tattoos, piercings & surprises into one epic evening. | 👉 Beginner friendly (5 km / 6:20) | 👉 Advanced (7-10 km / 5:45) |  | 🎧 Afterparty @ Freshlabels Sustainable Store powered by SONY | 🎶 Sony Chill Zona: XM6 experience | 🍽 Mamam Bistro | 🎧 DJ Johnny Caress | 🎟 Chance to win Post Malone tickets | 🎤 Surprise Performance |  | ⚠️ Capacity limited to 150 adventurers only — claim your spot now! | Let’s run, vibe & explore together. 🌍✨ |  | #sidequesty #runquest #adventure #feelingsidequesty #communityrun #sony #freshlabels #mamambistro #tattoo #piercing #community #curiosity #experience #meetnewpeople #meetnewfriends #stepintotheunknown #outdoor"
3656893904108910793,DK_5aF3s_jJ,https://www.instagram.com/p/DK_5aF3s_jJ/,2025-06-17,12:27:21,clips,131,6,,False,4,"Gramicci Spring Summer 25 |  | Nejnovější kolekce Gramicci je plná skvělých kousků, se kterými zvládnete léto ve městě i v přírodě  |  | Více v biu |  | 📹 @tomtejkl  | 👧 @d.e.n.a  | 👦 @bol_to_sen"
3656788923112392007,DK_hiassoVH,https://www.instagram.com/p/DK_hiassoVH/,2025-06-17,09:00:28,clips,139,8,,False,8,ROMEO A JULIE • out now • 🌙🌙🌙
3656772760764519168,DK_d3OVsZMA,https://www.instagram.com/p/DK_d3OVsZMA/,2025-06-17,08:21:44,carousel_container,128,1,,False,4,"Jägermeister x Flowers for Society  |  | Minulý týden jsme měli tu možnost představit vám nové limitky v podobě kolaba @jagermeistercz a @flowersforsociety  |  | Podívejte se, jak to vypadalo 👀 |  | 📸 @matesproc  |  | #freshlabels #beyondsurface #jägermeister"
3656402439445793049,DK-JqVvCckZ,https://www.instagram.com/p/DK-JqVvCckZ/,2025-06-16,20:05:58,carousel_container,123,4,,False,7,Natalie pro @freshlabels / second look
3654170683959270462,DK2OOBeCdw-,https://www.instagram.com/p/DK2OOBeCdw-/,2025-06-13,18:11:52,carousel_container,435,5,,False,3,with ma fav @birkenstock
3653457511259974884,DKzsD_ooizk,https://www.instagram.com/p/DKzsD_ooizk/,2025-06-12,18:36:35,clips,3,12,,False,4,🌞 108 POZDRAVŮ SLUNCI / NOVÝ ČESKÝ REKORD | Bacidani × Sidequesty × Freshlabels |  | 🗓 20. června 2025 od 18:00 | 📍pin lokace na webu @sidequesty  | 🧘‍♀️ Startujeme v 18:00 (flow bude trvat max. 2 hodiny) | 💸 Vstup FREE / dobrovolný příspěvek | 🎁 Prvních 20 registrovaných = Secret dárek od Freshlabels | 🧺 S sebou: vlastní podložku |  | Tak co? Kolik nás asi bude?😍😍😍 |  | #baciyoga
3652756790422675863,DKxMvKgCiGX,https://www.instagram.com/p/DKxMvKgCiGX/,2025-06-11,19:22:43,carousel_container,131,2,,False,7,Natalie pro @freshlabels / first look
3652752628367210487,DKxLymSM7f3,https://www.instagram.com/p/DKxLymSM7f3/,2025-06-11,19:17:09,clips,94,4,,False,6,"Jaro nebo léto? 🤯 |  | Inspirujte se těmi nejčerstvějšími outfity, které obstojí jak v dešti tak na sluníčku  |  | Více v biu |  | 📹 @veronikakramlova  | 👧 @natali9_7  |  | #freshlabels #beyondsurface #klättermusen #yerse"
3651874471812270610,DKuEHvQsAoS,https://www.instagram.com/p/DKuEHvQsAoS/,2025-06-10,14:09:43,feed,50,2,,False,3,"Brunch Rave & Spring Perfumes  |  | Přijďtě zažít vyjímečné niche parfémy @alexmonhart spojené s dj setem @_st.daniel_  a vyladěným brunchem od @hungryeyesprague  |  | 🗓️ Sobota 14.6. od 9:00 | 📍 Freshlabels Sustainable Store, Milady Horákové 11 P7 |  | #freshlabels #beyondsurface #alexmonhart"
3651312863524584122,DKsEbQyMnq6,https://www.instagram.com/p/DKsEbQyMnq6/,2025-06-09,19:33:54,carousel_container,1501,2,,False,3,"Vyrazil jsem na Šumavu - předtím ale povinná zastávka ve @freshlabels pro full climbing gear od @gramicci 🧗🏾‍♂️🌞 |  | Jsem hrozně rád za spolupráci s Freshem. Proč ? Před pár lety jsem tam pracoval a miloval jsem to. Teď se nám kruh uzavírá. Doufám, že se bude točit furt dál ! ♾️🫶🏽 |  | Stay Fresh ! 🤜🏻🤛🏽 |  | #spolupráce #freshlabels #lovebrand"
3651309635536885479,DKsDsSfIxbn,https://www.instagram.com/p/DKsDsSfIxbn/,2025-06-09,19:28:39,clips,3,8,,False,2,#allblackoutfit (& nejvíc basic) because of sušenky a vymáčklý kapsičky všude … 🫠😅🙋🏼‍♀️💃 |  | ✨triko @organicbasics  | ✨kraťasy @carharttwip  | ✨ponožky @carharttwip  |  | Vše z @freshlabels 🌱 | KÓD: FRESHBACI15 |  | #momsoutfit
3651286016707662782,DKr-UlvNhO-,https://www.instagram.com/p/DKr-UlvNhO-/,2025-06-09,18:40:33,carousel_container,675,15,,False,2,Fresh & Slow jak Evidence 🐌 díky @freshlabels 🤍
3651041579917911381,DKrGvkPMCVV,https://www.instagram.com/p/DKrGvkPMCVV/,2025-06-09,10:34:54,carousel_container,90,2,,False,1,Freshlabels Lookbook SS25 |  | Vyražte do ulic ve svěžích fitech inspirovaných lookbookem plným netradičních trendů stejně jako @arundus_  |  | Více v biu |  | 📸 @natythechild  | 👦 @arundus_  | 💄 @monikasnopkova  | 🖼️ @platna_backdrops  |  | #freshlabels #beyondsurface #lookbook #ss25
3650584840898866161,DKpe5I4M-vx,https://www.instagram.com/p/DKpe5I4M-vx/,2025-06-08,19:32:36,clips,2388,28,,False,2,"Rušno na návesáku! Když je bahna dost, maj vlaštovky hnízdo hotový třeba za pět dnů. Když je sucho a bahna málo, může to být i tři týdny. U nás je to letos fofr ❤️🪹 |  | #vlastovka #jiricka #bahno #voda #hnizdeni #priroda #ptaci #wildlife #filming #nature #nesting"
3649001722261670269,DKj27uwMgl9,https://www.instagram.com/p/DKj27uwMgl9/,2025-06-06,15:03:34,clips,79,8,,False,2,"Outfit měsíce s @cans_czsk  |  | Už jste otestovali drink letošního léta, Mango? 🥭 |  | #freshlabels #beyondsurface #drinkcans"
3648971056798652536,DKjv9fUKlh4,https://www.instagram.com/p/DKjv9fUKlh4/,2025-06-06,14:01:16,carousel_container,1207,3,,False,2,"👟🔥 LIMITKY JSOU VENKU! |  | Spojili jsme síly se značkou Flowers for Society. A výsledek? Tenisky, které mají v žilách bylinný vibe a chuť jít si vlastní cestou. | ⁠ | 💚🧡 Limitovanou edici těchhle sneakers najdeš exkluzivně na @freshlabels. Odkaz v biu. |  | #jagermeister #jagermeistercz #icecold #icecoldshot #bestnights #pijsrozumem"
3648876885924951420,DKjajH2sLV8,https://www.instagram.com/p/DKjajH2sLV8/,2025-06-06,10:57:21,clips,221,3,,False,11,ROMEO A JULIE out now¡ | . | . | na všech streamovacích platformách // klip na Youtube | . | . | @tomtejkl @dannyxnguyen @freshlabels @tomas_hajicek_jr @championshipmusic @universalmusiccz @jacob_hopes @rychtarikl  |  | #marcell #fiedlerski #romeoajulie
3648231670411258842,DKhH2AFMWva,https://www.instagram.com/p/DKhH2AFMWva/,2025-06-05,13:32:07,feed,292,10,,False,9,"seriózní foto seriózních lidí, co vydávají o půlnoci track"
3647514798535513022,DKek2JHsJO-,https://www.instagram.com/p/DKek2JHsJO-/,2025-06-04,13:50:47,clips,112,3,,False,4,Nejčerstvější kousky Armedangels najdete na našem webu 🤩 |  | Více v biu |  | #freshlabels #beyondsurface #armedangels #sonyczsk
3646244292465475121,DKaD92Isz4x,https://www.instagram.com/p/DKaD92Isz4x/,2025-06-02,19:44:16,clips,125,5,,False,7,"📺 Klip k songu MINUTE OF THE SUNRISE z dílny @tomtejkl vychází na YouTube už tuhle neděli! |  | Díky kámošům z @freshlabels že nás oblíkli na natáčení 🫶 |  | MINUTE OF THE SUNRISE- První song z nadcházejícího EP “The Great Unknown” vychází na Spotify, AppleMusic, atd. o půlnoci ze čtvrtka 5.6. na pátek 6.6. a odkaz na pre-save máme v biu!"
3646172347308759623,DKZzm5_MNpH,https://www.instagram.com/p/DKZzm5_MNpH/,2025-06-02,17:20:36,carousel_container,3,9,,False,2,"~ celá v @carharttwip, díky @freshlabels 🌟 |  | [ #carhartt #carharttwip #freshlabels #barter ]"
3645987377386763358,DKZJjPUsjRe,https://www.instagram.com/p/DKZJjPUsjRe/,2025-06-02,11:13:06,carousel_container,164,5,,False,2,"Ledově chladná flow, streetová energie a limitovanej drop. 💣💥 Pro ty, co vědí. Don’t miss out! |  | Release event by Jägermeister x Freshlabels 🦌🌾 | 📍 Flagship Store Jindřišská | 📫 Jindřišská 15, Praha | 📅 čtvrtek 5.6. v 18:00 |  | #jagermeister #jagermeistercz #icecold #icecoldshot #bestnights #pijsrozumem"
