Post_ID,Shortcode,URL,Date,Time,Format_Type,Likes,Comments,Views,Is_Paid_Partnership,Total_Collaborators,Caption
3744642474074486236,DP3pH1-DLXc,https://www.instagram.com/p/DP3pH1-DLXc/,2025-10-16,14:03:10,carousel_container,121,4,,False,2,YKRA |  | Vítáme ve Freshlabels fresh značku! Maďarské stylové batohy a doplňky @ykraco  |  | Každý kus je ručně vyráběný v Maďarsku z přírodních materiálů. V udržitelném dotazníku získala 6 bodů ze 7 |  | 📸 @natythechild
3744639623423497447,DP3oeXGApTn,https://www.instagram.com/p/DP3oeXGApTn/,2025-10-16,13:57:30,carousel_container,6184,10,,False,10,POV : zastaví tě podzim na D1 |  | 🧥: @freshlabels  | 🎥: @davidhavel.nrs
3744022083983115531,DP1cD-rCAUL,https://www.instagram.com/p/DP1cD-rCAUL/,2025-10-15,17:30:34,feed,3,2,,False,2,online objednávka + 🔝kabinky ve Freshi 🏅+ čistá pleť 🥲 = 🤳🏼+ odneseš si všecko ✔️🛍️🫢
3743800854932099875,DP0pwrECBMj,https://www.instagram.com/p/DP0pwrECBMj/,2025-10-15,10:13:46,clips,771,13,,False,2,dnes se naučím vyšívat (teda se o to alespoň pokusím) 🥸 | díky @freshlabels za batoh! 💚
3743155039733888419,DPyW60yjTWj,https://www.instagram.com/p/DPyW60yjTWj/,2025-10-14,12:47:54,feed,157,7,,False,9,"Další akce ve @vanami.store klepe na dveře! Tentokrát však s pořádnou dávkou podzimní pohodičky! ❣️🍁 |  | Těšit se můžete na nové obrazy a lidé caricature sketching  od @viktorievalentina pumpkin spice latte a další od @spill.the.matcha  | Šperky od @spoonringz a workshop od @zdobeny | Součástí budou i @freshlabels s jejich FREITAG produkty! 🍁 |  | Jeden z mých nejoblíbenějších seriálů, který mi často krátí čas u šití jsou Gilmore girls a co se víc hodí k podzimu než právě ony? ☕️ |  | Takže pokud jste i vy zatížení na tento seriál rozhodně se máte na co těšit 🤭☀️❣️  |  | Vezměte s sebou svoje kámoše a doražte 23.10. od 18:00 do Bořivojovy 70 🥰"
3742571932894772371,DPwSVgOijyT,https://www.instagram.com/p/DPwSVgOijyT/,2025-10-13,17:29:22,feed,50,5,,False,2,Letos stylově díky @freshlabels 🔥
3742476118079886950,DPv8jNuiNZm,https://www.instagram.com/p/DPv8jNuiNZm/,2025-10-13,14:19:00,carousel_container,61,0,,False,3,"FURIOSA® |  | Česká značka založená v roce 2024. Zrodila se z touhy dát ženám šperky, které nejsou jen ozdobou, ale každodenní připomínkou jejich vnitřní síly |  | 📸 @hudebnic"
3742328333162858242,DPva8qTDUcC,https://www.instagram.com/p/DPva8qTDUcC/,2025-10-13,09:25:23,carousel_container,502,12,,False,4,Růžová a mašličky? Tahle kombinace je prostě totální láska!😭🩷 | Díky @freshlabels můžu brázdit letenský kavárny i hory v Liberci v top vybavení.🩷
3741932543412089429,DPuA9KXjTJV,https://www.instagram.com/p/DPuA9KXjTJV/,2025-10-12,20:19:15,clips,100,5,,False,4,"Z @freshlabels jsem si přivezl nový Blundstony a uvařil kávu 🍂 |  | Od Freshlabels je i Carhartt bunda, takže díky, že mi ten midwest carpenter cosplay držíte při životě! 🤍 |  | 📷: @_annatti"
3741913698278079879,DPt8q7eCH2H,https://www.instagram.com/p/DPt8q7eCH2H/,2025-10-12,19:49:35,clips,359,9,,False,13,My newest video project “ISLAND BOY 1” drops next Sunday at 19:00 on my YouTube!🌴 | • | We’re also premiering it at @acidcoffeecz during the release party of the new card game @bombthehill_official 💥 | See you there 👀 | •  | 🎥:  | @wey.vasek  | @santidc13  | @janrys212  | • | Special thanks: | @astre_people  | @franceskoooo  | • | #downhill #skateboarding #extremesports #adrenaline #tenerife #explorepage
3741593850461312946,DPsz8h-iFey,https://www.instagram.com/p/DPsz8h-iFey/,2025-10-12,09:06:06,carousel_container,236,13,,False,2,"VYRAZILI JSME DO LESA 🍄‍🟫 —⁠ | Na houby, na procházku. Vyčistit hlavy, umazat boty.⁠ | ⁠ | Za výbavu díky @freshlabels 🫶⁠ | • bunda mrazobijka @patagonia⁠ | • mikina @carharttwip  | • taštičky @fjallravenofficial⁠ | ⁠ | Ještě potřebuju obměnit boty výletovky a rozmýšlím se mezi Salomonkama a On Cloudama. Někdo nějaký tip, prosím? 👟⁠ | —⁠ | #freshlabels #beyondsurface #spoluprace"
3740403730970636077,DPolWA1DO8t,https://www.instagram.com/p/DPolWA1DO8t/,2025-10-10,17:41:33,carousel_container,1010,1,,False,4,Cesta nahoru na horu. ⛰️ |  | 📸 @adamheres_
3739712564339970750,DPmIMNvjJK-,https://www.instagram.com/p/DPmIMNvjJK-/,2025-10-09,18:48:19,carousel_container,1253,3,,False,2,"Ohlížím se za létem, díky za něj 🐦‍⬛ |  | 1. Výstava psa | 2. Zlatěnce to taky sluší | 3. Letos nadúroda všeho 🤯 | 4. Cítíš borovicovej les | 5. Čerstvá vážka na pískovně | 6. Čtyřicátý jehně v sadu | 8. Děti z Bullerbinu | 9. Jistota pod stolem | 10. Busem na Gardu | 11. Tady jsem se krásně bál |  | #spoluprace #freshlabels #patagonia #leto #priroda #vylet #hory #pes #vazka"
3739483367847758430,DPlUE94DApe,https://www.instagram.com/p/DPlUE94DApe/,2025-10-09,11:18:38,clips,170,1,,False,4,"Podzim ve městě? |  | Není nad procházku sychravým městem a zastávkou na kávu a sladkost! A abyste se u toho cítili skvěle, máme pro vás to správné oblečení 🍁 |  | 🎥 @klimessebastian  | 📍 @solobakeryprg"
3739021583919648261,DPjrFIFDI4F,https://www.instagram.com/p/DPjrFIFDI4F/,2025-10-08,19:55:28,carousel_container,2691,8,,False,9,Přišli jsme se jenom podívat👀
3738126229199945232,DPgfgABCH4Q,https://www.instagram.com/p/DPgfgABCH4Q/,2025-10-07,14:22:31,clips,393,11,,False,10,"THE COMEBACK NOBODY ASKED FOR! ❤️‍🔥 | @reindeer_fest RESTART bude 10/10. Pátek, Krymská, 2 stage (@czech_inn_bar & @basement_krymska2), 6 kapel, tombola, zábava!  | TICKETS : Reindeer BIO 🫡 |  | POWERED BY: @jamesoncz & @freshlabels  |  | Uděláme si to hezký! 🫶 | #reindeer #reindeerfest #krymska"
3738122292518504545,DPgemtsiMhh,https://www.instagram.com/p/DPgemtsiMhh/,2025-10-07,14:08:44,carousel_container,37,0,,False,0,Patagonia FW25 |  | Pánské podzimní novinky Patagonia najdete online na Freshlabels 🤩 |  | 📸 @tomtejkl  | 👦 @david_kresl
3738089753829784448,DPgXNNrjTuA,https://www.instagram.com/p/DPgXNNrjTuA/,2025-10-07,13:04:05,carousel_container,1035,7,,False,3,Na Madeiře ve @freshlabels gearu❤️ |  | Díky za to a pro vás mam slevu FRESHGABI15  |  | Fotky od @adamheres_
3737541296446578686,DPeagG8DR_-,https://www.instagram.com/p/DPeagG8DR_-/,2025-10-06,18:58:21,clips,641,36,,False,2,"Omylem jsem se připletl do tréninku biatlonistů 🤪 | Nechtěl jsem je zdržovat… ale nějak to samo jelo 🛼💨 | Tak jsem si tu dal taky trénink 😄💪 |  | 👇 Jestli chceš, abych ukázal další trasy na brusle, | napiš do komentáře BRUSLE 🛼🔥 |  | #milujemeprirodu #sport #insta360x5 #biatlon #inlinebrusle #powerslide #ceskakrajina #vyzva"
3737541205790576765,DPeaeygiFB9,https://www.instagram.com/p/DPeaeygiFB9/,2025-10-06,18:57:19,clips,3,1,,False,2,Večerní pohodový cruise městem a topový 🩳 z @freshlabels !😎 | 🎥 @franceskoooo  | #skateboard #skateboarding #adrenaline #extremesports
3737252909407798533,DPdY7hlDAUF,https://www.instagram.com/p/DPdY7hlDAUF/,2025-10-06,09:21:25,carousel_container,28,1,,False,3,"One of XX |  | Nejnovější kolekce značky @one.of.xx z rukou @bas.timmer najdete online i na Freshlabels. Dvě trička, dvě barvy ale jeden příběh. Vše vyrobeno z deadstock materiálů |  | 📸 @ada_krem"
3736073200313604630,DPZMsf3jJoW,https://www.instagram.com/p/DPZMsf3jJoW/,2025-10-04,18:25:23,clips,61,4,,False,4,Signal INSIDE & Afterparties presented by @glo_czech Outfits 💃🏼 |  | Tak schválně. 🦦 Sladíte svůj outfit s námi? @freshlabels |  | Vidíme se brzy....👀 |  | #SignalFestival2025 16 → 19 10 Praha |  | // |  | Signal INSIDE & Afterparties presented by @glo_czech Outfits 💃🏼 |  | Can you match your fit with us? 🦦 We dare you. @freshlabels |  | See you soon….👀 |  | #SignalFestival2025 16 → 19 10 Prague
3735102835533826891,DPVwD1PjEtL,https://www.instagram.com/p/DPVwD1PjEtL/,2025-10-03,10:12:45,clips,79,2,,False,6,"Travel Essentials |  | Pátek je tu a s ním nová dobrodružství! Na koho dnes budete čekat na nádraží vy?  |  | PS: Než čekam vyrazíte, nezapomeňte volit 🤩 |  | 🎥 @klimessebastian"
3734660155066392662,DPULZ-7iaBW,https://www.instagram.com/p/DPULZ-7iaBW/,2025-10-02,19:33:07,clips,991,2,,False,4,Koho vykradou @gufrau_official příště? 👀⁠ | ⁠ | Sleduj celý rozhovor na YouTube ▶️ REFRESHERCZ⁠ | ⁠ | #REFRESHERCZ
3733896449810573024,DPRdwm_DSbg,https://www.instagram.com/p/DPRdwm_DSbg/,2025-10-01,18:17:28,clips,73,3,,False,4,"Den blbec má občas každý, mě v tom případě nesmí chybět kelímek na kafe, velká taška na všechny moje problémy a něco k tomu, a boty, v kterých běhání do vinohradských kopců bude doslova nebeské. |  | Za KPZtku na den blbec děkuju @freshlabels ☀️  |  | #barter"
3733817919982577349,DPRL52YjKbF,https://www.instagram.com/p/DPRL52YjKbF/,2025-10-01,15:44:42,clips,112,5,,False,3,"Patagonia Torrentshell 3L Jacket |  | Venku déšť a vítr? Naše oblíbená nepromokavá bunda, která nás podrží v každé situaci, podrží i vás. Najdete ji online na Freshlabels |  | 🎥 @klimessebastian"
3733238187276632708,DPPIFoOjAKE,https://www.instagram.com/p/DPPIFoOjAKE/,2025-09-30,20:26:39,clips,120,9,,False,4,"Oblečte se s námi na letošní Signal Festival! 🦋 |  | Společně s @freshlabels jsme pro vás vybrali pár kousků, ve kterých vám nebude zima ani při postávání před Ludmilou. |  | Tak se u nich nezapomeňte stavit a sledujte, co přijde příště! 👀 |  | #SignalFestival2025 #Freshlabels |  | // |  | Dress with us for this year’s Signal Festival! 🦋 |  | Together with @freshlabels, we’ve picked out a few pieces that will keep you warm—even while hanging around in front of Ludmila. |  | Don’t forget to stop by and keep an eye on what’s coming next! 👀 |  | #SignalFestival2025 #Freshlabels"
3733189932186644902,DPO9HbLDLGm,https://www.instagram.com/p/DPO9HbLDLGm/,2025-09-30,18:49:01,carousel_container,3,2,,False,3,"I grabbed my favorite @freshlabels outfit for a little adventure in the field 🌾📸 Shoutout to @wwhhaaaaaaaaaaaatt for capturing my jumps and the vibe, Really happy with the outcome. I’m curious 👀 which pic you like the most?  #pics #cornfield #dark #sky #jump #grab #freeze #figures #freshlabels #parkour #flying #clothes #outfit #praha #czech"
3732202603359794660,DPLcn5jDHXk,https://www.instagram.com/p/DPLcn5jDHXk/,2025-09-29,10:07:22,carousel_container,58,0,,False,6,Patagonia FW25 |  | Příval podzimních nových barev Patagonia najdete na Freshlabels 🍁 |  | 📸 @tomtejkl  | 👧 @jonasovadita  | 👦 @david_kresl
3731781834314127316,DPJ8851jJfU,https://www.instagram.com/p/DPJ8851jJfU/,2025-09-28,20:14:25,clips,737,3,,False,6,"@gufrau_official se ve své tvorbě ironicky i seriózně věnují nočnímu životu i tématům, které dnes řeší Gen Z. Ať už jde o bydlení u rodičů nebo vztahy. |  | V novém díle pořadu OFFSTAGE mluvila trojice třeba o tom, jak se poznali nebo proč je podle nich důležité jít k volbám.⁠ | ⁠ | Sleduj celé video na YouTube ▶️ REFRESHERCZ | ⁠ | #refreshercz ⁠"
3730747381064175777,DPGRvoLDJCh,https://www.instagram.com/p/DPGRvoLDJCh/,2025-09-27,10:00:28,clips,165,5,,False,6,Patagonia FW25 |  | Podzimní kolekce Patagonia přináší novou paletu barev do našich oblíbených kousků 🍂Online na Freshlabels nebo v našich prodejnách |  | 🎥 @tomtejkl  | 👧 @jonasovadita  | 👦 @david_kresl
3730058369408184032,DPD1FMEDC7g,https://www.instagram.com/p/DPD1FMEDC7g/,2025-09-26,11:07:42,clips,53,3,,False,4,No Matter Where You Go  |  | Patagonia Cragsmith |  | #freshlabels #patagonia
3729981759086433945,DPDjqXJCJaZ,https://www.instagram.com/p/DPDjqXJCJaZ/,2025-09-26,08:34:57,carousel_container,252,14,,False,12,"IT IS OFFICIAL, we are going to LESOTHO in 2026. |  | [ENG bellow] |  | S radostí oznamujeme, že již delší dobu připravujeme další projekt v Africe. Rozhodli jsme se podpořit komunitu @lesotho_skateboarding v malém vnitrozemském Lesothu na jihu afrického kontinentu. Již delší dobu komunikujeme s místní komunitou, podporujeme je vybavením a v roce 2024 jsme zemi navštívili a zajistili povolení stavby na krásném rozlehlém pozemku ve čtvrti Lepereng. Podobu skateparku máme již nakreslenou, materiály spočítány a plány pevně ukotveny v kalendáři. Tentokrát budeme ze 100% financovat stavbu ze sponzorských darů, především za finanční a technické pomoci @bonidee_skateparks  |  | K oslavě nové výpravy vás zveme 15.10. do @freshlabels na Milady Horákové kde plánujeme představit nový projekt, nové vizuály a především nový merch, který bude na místě od té doby k prodeji! Můžete nás tak podpořit ve snaze posunout skateboarding a jeho účinky zase o krok dál!  |  | Na akci mimo jiné proběhne živá show a promítání videa z realizovaného projektu ve Svazijsku! Prostor ozdobí fotografie z Etiopského projektu od @kubokrizo a závěr večera doladí @ideatnkd  @hey_emil a @james_cole_official svojí sadou. Na místě bude co pít i smlsnout díky @m.o.o.v.e.m.e.n.t bar!  |  | #skateworldbetter | #freshlabels  | #Afrika  |  | —————  |  | We are happy to announce a new project! We decided to support @lesotho_skateboarding in Lesotho, the tiny landlocked state in southern Africa. After visiting the country in 2024 we managed to secure the land in the Lepereng neighborhood. The skatepark yet has the shape on a paper and the departure is well marked in our calendar. This time we will finance the project purely from sponsors contributions and both financial and technical support of @bonidee_skateparks  |  | To celebrate this, we’d like to invite you to @freshlabels in Milady Horákové street. We will reveal the new project and drop the new merchandise that will be available at the store further on.  |  | Expect a live skate session, screening of a short video from the completed project in Swaziland and photographs by @kubokrizo from Ethiopia. Bar by @m.o.o.v.e.m.e.n.t"
3729311870042530261,DPBLWMWiGHV,https://www.instagram.com/p/DPBLWMWiGHV/,2025-09-25,10:24:00,carousel_container,3,10,,False,6,"😌Řekl někdo: podzim, déšť, kavárny, lezavo a comfy outfit? |  | ➡️mikina @carharttwip  | ➡️boty @blundstonecz_sk @blundstone  | ➡️káva @bonanzacoffee  | ➡️kód na slevu FRESHBACI15 |  | #autumnvibes"
3728789031040335359,DO_Ud4liD3_,https://www.instagram.com/p/DO_Ud4liD3_/,2025-09-24,17:05:13,carousel_container,3074,44,,False,2,Jesenné prechádzky ⛰️🐻 | . | . | @freshlabels  | . | . | . | . | . | #mountains#góry#smile#autumnmoments#autumnvibes#goodday#hikingviews#slovakia#zapadnetatry#slovakgirl#naturevibes
3728680098095444028,DO-7ss4DDA8,https://www.instagram.com/p/DO-7ss4DDA8/,2025-09-24,13:42:14,clips,88,7,,False,16,Family & Friends |  | Jak to vypadalo na našem networkingovém večeru pro komunitu kolem Freshlabels? |  | Koukněte na video 👀 |  | 🎥 @klimessebastian
3727931827710372093,DO8Rj7xjKj9,https://www.instagram.com/p/DO8Rj7xjKj9/,2025-09-23,12:42:06,carousel_container,96,3,,False,2,"FURIOSA® |  | Na Freshlabels je FURIOSA® nováčkem, ale už teď víme, že tu nebude do počtu. Její šperky stojí na kontrastu, minimalismus se tu potkává s odvahou, jemnost s charakterem.  |  | Online na Freshlabels"
3728087207622754121,DO805AmCD9J,https://www.instagram.com/p/DO805AmCD9J/,2025-09-23,07:20:00,clips,46,1,,False,4,"THE RUMOURS ARE TRUE: Když jdu vařit do přírody, balím všechen gear do @patagonia duffel bagu z @freshlabels 🤝 |  | A ty ho můžeš mít taky s 15% slevou při zadání kódu FRESHBALGIC15. Tak na co ještě čekáš? 🤫 |  | Fotky od one and only @jirka.stavek  |  | #spoluprace #duffelbag #patagonia"
3727315234051645865,DO6FXULjOGp,https://www.instagram.com/p/DO6FXULjOGp/,2025-09-22,16:17:02,carousel_container,54,3,,False,2,Máte nabitý den? |  | Hoďte ho za záda s dobrým batohem 🎒 |  | 📸 @terezakop
3726416304048586018,DO24-KYCj0i,https://www.instagram.com/p/DO24-KYCj0i/,2025-09-21,10:31:01,carousel_container,159,2,,False,2,Cooking for @bmwcz
3724927986010166786,DOxmkSMDBYC,https://www.instagram.com/p/DOxmkSMDBYC/,2025-09-19,09:14:00,carousel_container,106,5,,False,2,Armedangels FW25 🍂 |  | Podzimní příval dámských novinek @armedangels najdete online na Freshlabels |  | 📸 @natythechild
3724395307195718043,DOvtcyYiFmb,https://www.instagram.com/p/DOvtcyYiFmb/,2025-09-18,15:39:09,clips,3,5,,False,4,"🥹🩵🐑 |  | 📹: @otasn  | 👘: Salomonky a tríčo Carhartt WIP by one and only @freshlabels (spolupráce, kódík mám FRESHPANDA15, na Vánoce se vám bude hodit, tak si ho zapamatujte:D)"
3723536023239295901,DOsqEj1jIOd,https://www.instagram.com/p/DOsqEj1jIOd/,2025-09-17,11:11:13,clips,80,1,,False,3,"Made by students, approved by Fresh 🚀 |  | V rámci spolupráce s @vskk.cz vznikla tématická kampaň na Thinking MU.  |  | Fresh pohled mladých tvůrců na svět módy. |  | 👥 @tpirklova @nhorakovan @kackapavlickova"
3723450613746144772,DOsWpsDDJYE,https://www.instagram.com/p/DOsWpsDDJYE/,2025-09-17,08:20:36,clips,3,7,,False,2,"Nízkonákladové lety ✈️ s batohom čo spĺňa povolené rozmery a zmestí sa pod sedadlo💺 sú súčasťou môjho životného štýlu. Už dlhšie som cítila, že mi môj klasický Känken nestačí a to ho mám moc rada, ale na cesty, kde polovicu miesta zaberie moja kozmetická taštička bol malý. Takže som chcela niečo väčšie a praktickejšie, no a kam inam by som šla keď nie do @freshlabels 🎒.  |  | Už doma som si na e-shope spravila predvýber, majú to tam dobre a jasne rozdelené aj pre ľudí ako som ja, čo prvotne vyberajú veci podľa farby (ako ja).😁  |  | *Tento môj #patagonia je v hnedej už vypredaný, ale majú ho stále v modrej a klasicky čiernej.  |  | 🔥 A na všetko nezľavnené platí zľava 15% s kódom FRESHBEKA15, aj keď je mi jasné, že ja na letisku ani v lietadle nikdy fresh nevyzerám.😆 |  | #dlhodobaspolupraca #styleofbecca #freshlabels #cestovnybatoh"
3723416280012170772,DOsO2ERCCYU,https://www.instagram.com/p/DOsO2ERCCYU/,2025-09-17,07:10:00,carousel_container,184,5,,False,4,Čecháček na cestě do Chorvatska - essentials lookbook 🥪🍻 |  | 👔: @freshlabels  | 📸: @jirka.stavek  |  | #spoluprace #rizek #pivo #dnescestujeme #chorvatsko #czechboy
3722986355857977681,DOqtF2MinFR,https://www.instagram.com/p/DOqtF2MinFR/,2025-09-16,16:56:20,carousel_container,313,2,,False,3,This spring we had some time to take a short trip with the team to Austria for skiing. 3 days on the slopes full of fun and rest. A big thanks to @freshlabels for the  vests. The perfect solution for Alpine sunbathing.
3722779766806831450,DOp-HlJiGFa,https://www.instagram.com/p/DOp-HlJiGFa/,2025-09-16,10:05:52,carousel_container,626,1,,False,5,"Mimo Done tour se ukazem v Praze ve @freshlabels na akci Skate World Better. 15/10 je ten den a 20:00 je ten cas. Zahraju DJ set a na par tracku  do nej vklouzne @james_cole_official. | Dorazte, bude jidlo, bar a zazitky. |  | Foto: @stepansvisual"
3722770244118038205,DOp79AdDMa9,https://www.instagram.com/p/DOp79AdDMa9/,2025-09-16,09:46:57,carousel_container,75,1,,False,4,"Armedangels FW25 |  | Babí léto a jeho zažloutlé listy jsou tady, stejně jako příval podzimních novinek značky @armedangels  |  | 📸 @natythechild  | 👧 @laura_vranova  | 👦 @soott"
3722021726847780394,DOnRwpbDEYq,https://www.instagram.com/p/DOnRwpbDEYq/,2025-09-15,09:01:42,clips,22,1,,False,3,Máte nabitý den? 🎒 |  | Hoďte ho za záda s dobrým batohem |  | 🎥 @stary.vojta
3720005661171148016,DOgHXB8jGTw,https://www.instagram.com/p/DOgHXB8jGTw/,2025-09-12,14:14:13,feed,3,7,,False,5,"Další Fresh talk je tady! @martinionice_ je sportovec, jeden z mála našich reprezentantů v tzv. ice crossu. Že nevíte, o co jde? Nezoufejte, v tomhle Mrzení najdete odpovědi na všechno, co jste chtěli vědět, i na to, co jste vědět nechtěli. Jak moc je ice cross niche sport? Proč brzo Martin začne pracovat na založení profilu nožního OF? Jaké chrániče jsou potřeba a co všechno je dovoleno? Zjistíte, že swag je to nejdůležitější (nejen ve sportu), kdy a kde je vlastně sezóna tohoto sportu a taky to, jak tahle obsese vůbec u Martina začala. Probereme první závody, historky o padajících letadlech i padajících lidech na ledu, závislost na adrenalinu a na chráničích a taky to, jestli tenhle sport má bejt na Olympiádě nebo ne. |  | V herohero.co/mrzeni dostanete tip na to, jak se zbavit celulitidy (doporučuje prej cca 60 letá surfařka), takže celulitido, třes se. Taky se ale pobavíme o tom, co dělá Martin mimo sezónu, když zrovna nesurfuje. Najdeme ho na poli sbírat bavlnu? “Oni si všichni myslí, jakej žiju skvělej život, ale ono to tak úplně není,” říká Martin. Taky se bavíme o bezpečnosti ve Státech (díl se točil před vraždou Ch. Kirka), o tom, jak byl Martin na jeho vkus až mockrát ve špatnej čas na špatným místě. Ať už šlo o tornáda na dvorku, uvězněný lodě v Japonsku, nebo závody v Rusku v ten nejhorší možnej čas. A taky se pobavíme o tom, že gatekeepování čehokoliv je extrémně otravný. Nedělejte to. |  | Díl vznikl i díky naší spolupráci s @freshlabels. Využít díky tomu můžete slevičku 15% s kódem MRZENI15. Děkujeme! |  | #beyondsurface #freshlabels #mrzeni #spoluprace #icecross"
3719243299484866519,DOdaBNTDBfX,https://www.instagram.com/p/DOdaBNTDBfX/,2025-09-11,13:00:36,clips,240,10,,False,6,DREAMERS GARDEN…where dreams bloom.  | @kowloneon & @linda_pro_design collaboration |  | 📍HONG KONG & CZECH REPUBLIC | @hkdesigncentre & @freshlabels  |  | NEONS & BOHEMIAN HAND BLOWN CRYSTAL GLASS
3718609979236017262,DObKBL2leRu,https://www.instagram.com/p/DObKBL2leRu/,2025-09-10,16:03:46,clips,247,0,,False,4,"Co nosíš ve školním batohu nebo tašce ty? 👀🎒⁠ | ⁠ | Na to jsme se ptali začátkem školního roku a rozdávali jsme vouchery do @freshlabels, kde najdeš nejen batohy, co unesou i tvoje skripta a notebook. ⁠ | ⁠ | ▶️ Celé video sleduj na našem YouTube ⁠ | ⁠ | #refreshercz #spoluprace #freshlabels"
3718427704690529443,DOagkvdDNSj,https://www.instagram.com/p/DOagkvdDNSj/,2025-09-10,09:59:06,carousel_container,30,0,,False,0,"Batohy se kupují na Freshlabels |  | pinqponq, německý design, kvalita a udržitelnost v jednom. Online na Freshlabels. |  | 📸 @terezakop"
3717964199319371040,DOY3L2cDP0g,https://www.instagram.com/p/DOY3L2cDP0g/,2025-09-09,18:44:16,clips,3,24,,False,3,"Discovering the magic of Greece 🏖️🌊 Sun, sea, and featuring the perfect Freshlabels style 👕👖👟 | First time in Corfu and I hope it won’t be the last because I fell in love with the island. Not big jumps this time, I just wanted to share the last of the summer vibes with you and a happy Jeff 😎 #travel #trip #playa #greece #grecia #fresh #freshlabels #transition #swim #beach #corfu #outfit #water #kafubanton"
3717058075321697912,DOVpKAtDAZ4,https://www.instagram.com/p/DOVpKAtDAZ4/,2025-09-08,12:44:13,clips,86,2,,False,13,Behind the scenes 👀 |  | Jak vypadala produkce naší poslední kampaně Batohy se kupují na Freshlabels? Koukněte na video  |  | 🎥 @stary.vojta | 📸 @terezakop  | 👥 @natythechild @zdenekpiskula @bacidani @annie_ertl  | 🗣️ @kasparhonza @bacidani  | 🎶 @spacecoupe_n2o  | 🦺 @serafimaaaaaaaaaaaa @paseckyadam | 📍 @kvalitar @cafe.tvaroh @bio_oko
3716218257414836981,DOSqNDVCFL1,https://www.instagram.com/p/DOSqNDVCFL1/,2025-09-07,08:49:20,carousel_container,1242,6,,False,2,Chtěl bych poděkovat společnosti @freshlabels že mě nechává si vybrat oblečení ktery se mi líbí. Děkuju
3715585844091322635,DOQaaOhiIEL,https://www.instagram.com/p/DOQaaOhiIEL/,2025-09-14,09:24:36,clips,208,6,,False,6,"Klasicky pondělí a sidequest jak má být. Otestovaný limity, nový itemy a skvělá komunita lidí. Tak dojdi příště s náma, každý pondělí 17:50 ve Freshlabels M. Horákové 11 Praha"
3714944037850730846,DOOIet4jFFe,https://www.instagram.com/p/DOOIet4jFFe/,2025-09-05,14:37:41,carousel_container,21,0,,False,2,"Batohy se kupují na Freshlabels |  | Fjällräven, naši oblíbenou polární lišku, najdete online na Freshlabels |  | 📸 @terezakop  | 📍 @kvalitar"
3714396114117290699,DOML5YJDWrL,https://www.instagram.com/p/DOML5YJDWrL/,2025-09-04,20:29:03,carousel_container,411,2,,False,7,Miluju děkuju vol. II ~ @freshlabels 🫂🤍
3714031885505552831,DOK5FJ0CGG_,https://www.instagram.com/p/DOK5FJ0CGG_/,2025-09-04,08:26:21,clips,3,17,,False,3,"🙆🏼‍♀️Nemusí to dávat logiku, ALE!⤵️ |  | • menší tašku mám permanentně ready (kliče, telefon, mimi dobroty, lesk na rty, hřeben, žvejky, palo santo, …) |  | • když potřebuju jet někam, kde je potřeba PC, vzít si věci na jógu, svačinu, mikinu ➡️ zabalím to do větší tašky  |  | • a jelikož mě nebaví pořád přendavat věci z jedné tašky do druhé = mám je zabalené separé a jednoduše menší dám do větší … 😅😅😅 |  | No, a teď mi řeknete, dává to smysl? — 🙈🙈🙈 |  | 🙋🏼‍♀️Tašky jsou @we.are.kaala a miluju je moc. |  | Tak pa, | Baci♥️ |  | #baghack #bagpackhack #baglover"
